{"artifact_sha256":"14da4b22a7e7dda93fd94187c59df6076d3acc84b3565df9dab204732d108fdd","checkpoint_target_tokens":5000000,"packed_sequence_ids":[1,65537,131073,131074,131075,131076,131077,196609,16777217,16842753,16908289,16908290,16908291,16908292,16908293,16973825,33554433,33619969,33685505,33685506,33685507,33751041,33751042,50331649,50331650,50331651,50397185,50462721,50528257,50528258,67108865,67174401,67174402,67239937,67305473,67305474,83886081,83886082,83886083,83886084,83886085,83951617,83951618,83951619,83951620,84017153,84082689,84082690,100663297,100728833,100728834,100728835,100728836,100794369,100794370,100859905,100859906,100859907,100859908,117440513,117440514,117440515,117506049,117571585,117637121,134217729,134283265,134348801,134414337,134414338,134414339,134414340,150994945,150994946,151060481,151060482,151060483,151060484,151126017,151126018,151191553,167772161,167772162,167772163,167772164,167837697,167903233,167903234,167903235,167968769,167968770,184549377,184549378,184549379,184549380,184614913,184680449,184680450,184680451,184680452,184745985,201326593,201326594,201392129,201457665,201523201,218103809,218103810,218103811,218103812,218103813,218169345,218234881,218234882,218300417,234881025,234881026,234881027,234946561,234946562,235012097,235077633,251658241,251723777,251789313,251789314,251854849,251854850,251854851,268435457,268435458,268500993,268500994,268500995,268566529,268566530,268632065,285212673,285212674,285212675,285212676,285278209,285278210,285278211,285343745,285409281,301989889,301989890,301989891,302055425,302120961,302120962,302186497,302186498,302186499,302186500,302186501,318767105,318832641,318898177,72057594037927937,72057594037993473,72057594038059009,72057594038124545,72057594054705153,72057594054770689,72057594054836225,72057594054901761,72057594071482369,72057594071547905,72057594071613441,72057594071678977,72057594071678978,72057594071678979,72057594088259585,72057594088259586,72057594088259587,72057594088259588,72057594088259589,72057594088259590,72057594088259591,72057594088325121,72057594088390657,72057594088390658,72057594088456193,72057594088456194,72057594088456195,72057594088456196,72057594105036801,72057594105036802,72057594105036803,72057594105102337,72057594105167873,72057594105233409,72057594105233410,72057594105233411,72057594105233412,72057594105233413,72057594105233414,72057594121814017,72057594121879553,72057594121879554,72057594121945089,72057594122010625,72057594138591233,72057594138656769,72057594138656770,72057594138656771,72057594138656772,72057594138656773,72057594138656774,72057594138722305,72057594138787841,72057594155368449,72057594155368450,72057594155368451,72057594155368452,72057594155433985,72057594155433986,72057594155499521,72057594155565057,72057594172145665,72057594172211201,72057594172276737,72057594172276738,72057594172276739,72057594172342273,72057594188922881,72057594188922882,72057594188988417,72057594188988418,72057594188988419,72057594188988420,72057594189053953,72057594189119489,72057594189119490,72057594189119491,72057594189119492,72057594189119493,72057594205700097,72057594205700098,72057594205700099,72057594205700100,72057594205765633,72057594205765634,72057594205831169,72057594205831170,72057594205831171,72057594205831172,72057594205831173,72057594205831174,72057594205896705,72057594205896706,72057594205896707,72057594222477313,72057594222477314,72057594222542849,72057594222542850,72057594222608385,72057594222608386,72057594222608387,72057594222673921,72057594239254529,72057594239254530,72057594239254531,72057594239320065,72057594239320066,72057594239320067,72057594239385601,72057594239451137,72057594239451138,72057594256031745,72057594256031746,72057594256097281,72057594256097282,72057594256097283,72057594256162817,72057594256162818,72057594256228353,72057594272808961,72057594272808962,72057594272808963,72057594272808964,72057594272874497,72057594272874498,72057594272940033,72057594272940034,72057594273005569,72057594273005570,72057594289586177,72057594289586178,72057594289651713,72057594289651714,72057594289651715,72057594289717249,72057594289782785,72057594306363393,72057594306428929,72057594306494465,72057594306494466,72057594306560001,72057594323140609,72057594323206145,72057594323271681,72057594323337217,72057594339917825,72057594339917826,72057594339983361,72057594339983362,72057594339983363,72057594339983364,72057594339983365,72057594340048897,72057594340048898,72057594340114433,72057594340114434,72057594356695041,144115188075855873,144115188075855874,144115188075921409,144115188075921410,144115188075986945,144115188075986946,144115188076052481,144115188076052482,144115188076052483,144115188076052484,144115188076052485,144115188092633089,144115188092633090,144115188092698625,144115188092698626,144115188092764161,144115188092764162,144115188092829697,144115188092829698,144115188092829699,144115188092829700,144115188092829701,144115188109410305,144115188109410306,144115188109475841,144115188109475842,144115188109475843,144115188109475844,144115188109475845,144115188109541377,144115188109541378,144115188109541379,144115188109541380,144115188109541381,144115188109606913,144115188109606914,144115188109606915,144115188126187521,144115188126187522,144115188126253057,144115188126253058,144115188126318593,144115188126384129,144115188126384130,144115188142964737,144115188142964738,144115188143030273,144115188143030274,144115188143095809,144115188143161345,144115188143161346,144115188143161347,144115188159741953,144115188159741954,144115188159741955,144115188159807489,144115188159873025,144115188159938561,144115188176519169,144115188176584705,144115188176584706,144115188176584707,144115188176584708,144115188176650241,144115188176650242,144115188176715777,144115188176715778,144115188193296385,144115188193296386,144115188193361921,144115188193427457,144115188193492993,144115188210073601,144115188210073602,144115188210073603,144115188210073604,144115188210073605,144115188210139137,144115188210204673,144115188210270209,144115188226850817,144115188226916353,144115188226981889,144115188226981890,144115188226981891,144115188227047425,144115188227047426,144115188243628033,144115188243628034,144115188243628035,144115188243628036,144115188243693569,144115188243759105,144115188243824641,144115188243824642,144115188260405249,144115188260470785,144115188260536321,144115188260536322,144115188260601857,144115188277182465,144115188277248001,144115188277313537,144115188277313538,144115188277313539,144115188277379073,144115188293959681,144115188293959682,144115188293959683,144115188294025217,144115188294090753,144115188294156289,144115188310736897,144115188310802433,144115188310802434,144115188310802435,144115188310802436,144115188310867969,144115188310933505,144115188327514113,144115188327579649,144115188327579650,144115188327579651,144115188327579652,144115188327579653,144115188327645185,144115188327645186,144115188327710721,144115188344291329,144115188344291330,144115188344356865,144115188344422401,144115188344487937,144115188361068545,144115188361068546,144115188361134081,144115188361134082,144115188361199617,144115188361199618,144115188361265153,144115188377845761,144115188377845762,144115188377911297,216172782113783809,216172782113783810,216172782113783811,216172782113783812,216172782113783813,216172782113849345,216172782113914881,216172782113980417,216172782113980418,216172782113980419,216172782113980420,216172782113980421,216172782113980422,216172782130561025,216172782130561026,216172782130561027,216172782130561028,216172782130561029,216172782130626561,216172782130692097,216172782130757633,216172782130757634,216172782130757635,216172782130757636,216172782130757637,216172782130757638,216172782147338241,216172782147403777,216172782147403778,216172782147469313,216172782147469314,216172782147469315,216172782147469316,216172782147469317,216172782147469318,216172782147469319,216172782147534849,216172782164115457,216172782164115458,216172782164115459,216172782164115460,216172782164180993,216172782164246529,216172782164246530,216172782164312065,216172782164312066,216172782180892673,216172782180958209,216172782181023745,216172782181023746,216172782181023747,216172782181089281,216172782197669889,216172782197669890,216172782197735425,216172782197735426,216172782197735427,216172782197800961,216172782197866497,216172782197866498,216172782197866499,216172782197866500,216172782214447105,216172782214512641,216172782214512642,216172782214578177,216172782214578178,216172782214643713,216172782231224321,216172782231224322,216172782231289857,216172782231355393,216172782231420929,216172782248001537,216172782248067073,216172782248067074,216172782248067075,216172782248067076,216172782248067077,216172782248067078,216172782248067079,216172782248132609,216172782248132610,216172782248132611,216172782248132612,216172782248198145,216172782264778753,216172782264844289,216172782264844290,216172782264844291,216172782264844292,216172782264909825,216172782264975361,216172782281555969,216172782281621505,216172782281687041,216172782281687042,216172782281687043,216172782281687044,216172782281752577,216172782298333185,216172782298333186,216172782298333187,216172782298398721,216172782298464257,216172782298529793,216172782298529794,216172782298529795,216172782315110401,216172782315175937,216172782315175938,216172782315175939,216172782315175940,216172782315241473,216172782315307009,216172782315307010,216172782315307011,216172782331887617,216172782331953153,216172782331953154,216172782332018689,216172782332084225,216172782332084226,216172782332084227,216172782348664833,216172782348730369,216172782348730370,216172782348730371,216172782348795905,216172782348861441,216172782365442049,216172782365442050,216172782365442051,216172782365442052,216172782365507585,216172782365507586,216172782365507587,216172782365507588,216172782365573121,216172782365638657,216172782365638658,216172782365638659,216172782365638660,216172782382219265,216172782382219266,216172782382284801,216172782